idnota,fk_idalumno_nota,fk_idmateriacurso_nota,nota1_nota,nota2_nota,nota3_nota,notadic_nota,notafeb_nota,notadef_nota,obs_nota,createdAt,updatedAt,ciclo_lectivo_nota
209,,,,,,,,,nec nisi volutpat eleifend donec ut dolor morbi vel lectus in quam fringilla rhoncus,2023-02-08,,2023
210,,,,,,,,,urna pretium nisl ut volutpat sapien arcu sed augue aliquam erat volutpat in,2023-07-31,,2023
211,,,,,,,,,vestibulum quam sapien varius ut blandit non interdum in ante vestibulum ante ipsum primis in faucibus orci,2023-07-05,,2023
212,,,,,,,,,sapien placerat ante nulla justo aliquam quis turpis eget elit sodales scelerisque,2023-03-24,,2023
213,,,,,,,,,quisque id justo sit amet sapien dignissim vestibulum vestibulum ante ipsum primis in faucibus orci luctus et,2023-10-29,,2023
214,,,,,,,,,in faucibus orci luctus et ultrices posuere cubilia curae nulla dapibus dolor vel est donec,2023-04-28,,2023
215,,,,,,,,,id pretium iaculis diam erat fermentum justo nec condimentum neque sapien,2023-02-16,,2023
216,,,,,,,,,dolor vel est donec odio justo sollicitudin ut suscipit a feugiat et eros vestibulum,2023-06-14,,2023
217,,,,,,,,,sed augue aliquam erat volutpat in congue etiam justo etiam pretium iaculis,2023-02-03,,2023
218,,,,,,,,,sit amet consectetuer adipiscing elit proin interdum mauris non ligula,2023-11-02,,2023
219,,,,,,,,,sem duis aliquam convallis nunc proin at turpis a pede posuere nonummy integer non velit donec diam neque vestibulum eget,2023-02-26,,2023
220,,,,,,,,,aliquam augue quam sollicitudin vitae consectetuer eget rutrum at lorem integer tincidunt ante vel,2023-08-13,,2023
221,,,,,,,,,sed vel enim sit amet nunc viverra dapibus nulla suscipit ligula in lacus curabitur at ipsum ac tellus semper interdum,2023-11-23,,2023
222,,,,,,,,,et magnis dis parturient montes nascetur ridiculus mus etiam vel augue,2023-12-24,,2023
223,,,,,,,,,posuere nonummy integer non velit donec diam neque vestibulum eget vulputate ut ultrices vel augue,2023-08-23,,2023
224,,,,,,,,,accumsan tortor quis turpis sed ante vivamus tortor duis mattis egestas metus aenean fermentum donec ut mauris eget massa tempor,2023-07-20,,2023
225,,,,,,,,,luctus cum sociis natoque penatibus et magnis dis parturient montes,2023-08-04,,2023
226,,,,,,,,,quisque erat eros viverra eget congue eget semper rutrum nulla nunc purus phasellus in felis donec,2023-06-03,,2023
227,,,,,,,,,quam nec dui luctus rutrum nulla tellus in sagittis dui vel nisl,2023-12-16,,2023
228,,,,,,,,,a libero nam dui proin leo odio porttitor id consequat in,2023-11-19,,2023
229,,,,,,,,,posuere cubilia curae mauris viverra diam vitae quam suspendisse potenti nullam porttitor,2023-07-22,,2023
230,,,,,,,,,pede ac diam cras pellentesque volutpat dui maecenas tristique est et,2023-12-15,,2023
231,,,,,,,,,convallis eget eleifend luctus ultricies eu nibh quisque id justo sit amet sapien dignissim,2023-09-01,,2023
232,,,,,,,,,at turpis a pede posuere nonummy integer non velit donec diam neque vestibulum,2023-08-02,,2023
233,,,,,,,,,porta volutpat erat quisque erat eros viverra eget congue eget semper,2023-12-16,,2023
234,,,,,,,,,nec nisi vulputate nonummy maecenas tincidunt lacus at velit vivamus,2023-11-08,,2023
235,,,,,,,,,turpis nec euismod scelerisque quam turpis adipiscing lorem vitae mattis,2023-01-23,,2023
236,,,,,,,,,ultrices erat tortor sollicitudin mi sit amet lobortis sapien sapien non mi,2023-10-01,,2023
237,,,,,,,,,placerat ante nulla justo aliquam quis turpis eget elit sodales scelerisque mauris sit amet eros suspendisse accumsan tortor,2023-12-07,,2023
238,,,,,,,,,in consequat ut nulla sed accumsan felis ut at dolor quis odio consequat varius integer ac leo pellentesque,2023-09-03,,2023
239,,,,,,,,,auctor gravida sem praesent id massa id nisl venenatis lacinia aenean sit amet justo morbi ut odio cras,2023-08-07,,2023
240,,,,,,,,,dapibus augue vel accumsan tellus nisi eu orci mauris lacinia sapien quis,2023-01-15,,2023
241,,,,,,,,,eleifend donec ut dolor morbi vel lectus in quam fringilla rhoncus mauris,2023-03-15,,2023
242,,,,,,,,,sapien cursus vestibulum proin eu mi nulla ac enim in tempor turpis nec,2023-02-06,,2023
243,,,,,,,,,tristique in tempus sit amet sem fusce consequat nulla nisl nunc nisl,2023-04-22,,2023
244,,,,,,,,,est donec odio justo sollicitudin ut suscipit a feugiat et eros vestibulum ac est lacinia,2023-11-04,,2023
245,,,,,,,,,vestibulum vestibulum ante ipsum primis in faucibus orci luctus et,2023-12-14,,2023
246,,,,,,,,,felis ut at dolor quis odio consequat varius integer ac leo,2023-11-23,,2023
247,,,,,,,,,nullam molestie nibh in lectus pellentesque at nulla suspendisse potenti cras in purus eu magna vulputate luctus,2023-08-09,,2023
248,,,,,,,,,ac enim in tempor turpis nec euismod scelerisque quam turpis adipiscing lorem vitae mattis nibh ligula nec sem duis,2023-04-03,,2023
249,,,,,,,,,primis in faucibus orci luctus et ultrices posuere cubilia curae donec pharetra magna vestibulum aliquet ultrices,2023-03-01,,2023
250,,,,,,,,,nulla quisque arcu libero rutrum ac lobortis vel dapibus at diam nam,2023-07-18,,2023
251,,,,,,,,,ac nibh fusce lacus purus aliquet at feugiat non pretium quis lectus suspendisse potenti,2023-05-29,,2023
252,,,,,,,,,pede ullamcorper augue a suscipit nulla elit ac nulla sed vel enim sit amet nunc,2023-09-20,,2023
253,,,,,,,,,consequat dui nec nisi volutpat eleifend donec ut dolor morbi vel,2023-03-23,,2023
254,,,,,,,,,consequat dui nec nisi volutpat eleifend donec ut dolor morbi vel lectus in quam,2023-06-28,,2023
255,,,,,,,,,magnis dis parturient montes nascetur ridiculus mus vivamus vestibulum sagittis sapien cum sociis natoque penatibus et magnis dis parturient,2023-02-10,,2023
256,,,,,,,,,vitae consectetuer eget rutrum at lorem integer tincidunt ante vel ipsum,2023-01-13,,2023
257,,,,,,,,,elementum pellentesque quisque porta volutpat erat quisque erat eros viverra eget congue eget semper rutrum nulla nunc purus phasellus in,2023-07-27,,2023
258,,,,,,,,,tempus sit amet sem fusce consequat nulla nisl nunc nisl,2023-10-17,,2023
259,,,,,,,,,nam dui proin leo odio porttitor id consequat in consequat ut nulla sed accumsan felis ut at,2023-02-01,,2023
260,,,,,,,,,commodo vulputate justo in blandit ultrices enim lorem ipsum dolor sit amet consectetuer adipiscing,2023-02-18,,2023
261,,,,,,,,,sit amet erat nulla tempus vivamus in felis eu sapien cursus vestibulum proin eu mi nulla ac enim in tempor,2023-06-05,,2023
262,,,,,,,,,odio condimentum id luctus nec molestie sed justo pellentesque viverra pede ac diam,2023-05-07,,2023
263,,,,,,,,,lectus pellentesque eget nunc donec quis orci eget orci vehicula condimentum curabitur,2023-05-29,,2023
264,,,,,,,,,non lectus aliquam sit amet diam in magna bibendum imperdiet nullam orci pede venenatis non sodales sed tincidunt eu,2023-09-23,,2023
265,,,,,,,,,nibh quisque id justo sit amet sapien dignissim vestibulum vestibulum ante ipsum,2023-04-30,,2023
266,,,,,,,,,augue vel accumsan tellus nisi eu orci mauris lacinia sapien quis libero nullam sit amet turpis elementum,2023-12-28,,2023
267,,,,,,,,,eros suspendisse accumsan tortor quis turpis sed ante vivamus tortor duis mattis egestas metus aenean fermentum donec ut,2023-01-05,,2023
268,,,,,,,,,adipiscing elit proin interdum mauris non ligula pellentesque ultrices phasellus id sapien in sapien iaculis congue,2023-02-26,,2023
269,,,,,,,,,nullam sit amet turpis elementum ligula vehicula consequat morbi a ipsum integer a nibh,2023-11-22,,2023
270,,,,,,,,,convallis duis consequat dui nec nisi volutpat eleifend donec ut dolor morbi vel lectus in quam fringilla rhoncus,2023-05-08,,2023
271,,,,,,,,,vitae mattis nibh ligula nec sem duis aliquam convallis nunc proin at turpis a pede,2023-07-13,,2023
272,,,,,,,,,felis eu sapien cursus vestibulum proin eu mi nulla ac enim in tempor turpis nec euismod scelerisque quam turpis adipiscing,2023-08-27,,2023
273,,,,,,,,,quis orci nullam molestie nibh in lectus pellentesque at nulla suspendisse potenti cras,2023-08-14,,2023
274,,,,,,,,,in purus eu magna vulputate luctus cum sociis natoque penatibus et magnis dis parturient montes nascetur ridiculus,2023-09-17,,2023
275,,,,,,,,,felis sed lacus morbi sem mauris laoreet ut rhoncus aliquet pulvinar sed nisl nunc,2023-03-17,,2023
276,,,,,,,,,nibh fusce lacus purus aliquet at feugiat non pretium quis lectus suspendisse potenti in eleifend,2023-09-08,,2023
277,,,,,,,,,consequat lectus in est risus auctor sed tristique in tempus sit amet,2023-05-29,,2023
278,,,,,,,,,pellentesque volutpat dui maecenas tristique est et tempus semper est quam pharetra magna ac consequat,2023-11-04,,2023
279,,,,,,,,,vestibulum aliquet ultrices erat tortor sollicitudin mi sit amet lobortis sapien sapien,2023-04-03,,2023
280,,,,,,,,,lacinia eget tincidunt eget tempus vel pede morbi porttitor lorem id ligula,2023-09-16,,2023
281,,,,,,,,,sociis natoque penatibus et magnis dis parturient montes nascetur ridiculus mus vivamus vestibulum sagittis,2023-03-13,,2023
282,,,,,,,,,nec nisi volutpat eleifend donec ut dolor morbi vel lectus in quam,2023-10-28,,2023
283,,,,,,,,,luctus et ultrices posuere cubilia curae mauris viverra diam vitae quam suspendisse,2023-03-17,,2023
284,,,,,,,,,fusce consequat nulla nisl nunc nisl duis bibendum felis sed interdum venenatis turpis enim blandit mi in porttitor pede,2023-10-29,,2023
285,,,,,,,,,aliquam augue quam sollicitudin vitae consectetuer eget rutrum at lorem integer tincidunt ante vel ipsum,2023-02-06,,2023
286,,,,,,,,,etiam faucibus cursus urna ut tellus nulla ut erat id,2023-10-30,,2023
287,,,,,,,,,duis aliquam convallis nunc proin at turpis a pede posuere nonummy integer,2023-03-20,,2023
288,,,,,,,,,nec nisi vulputate nonummy maecenas tincidunt lacus at velit vivamus,2023-09-29,,2023
289,,,,,,,,,lobortis est phasellus sit amet erat nulla tempus vivamus in felis eu sapien cursus vestibulum proin eu mi nulla,2023-12-23,,2023
290,,,,,,,,,nullam porttitor lacus at turpis donec posuere metus vitae ipsum aliquam non mauris morbi non,2023-06-05,,2023
291,,,,,,,,,amet sapien dignissim vestibulum vestibulum ante ipsum primis in faucibus orci,2023-02-01,,2023
292,,,,,,,,,consequat ut nulla sed accumsan felis ut at dolor quis odio consequat varius,2023-01-27,,2023
293,,,,,,,,,eget eros elementum pellentesque quisque porta volutpat erat quisque erat eros,2023-07-24,,2023
294,,,,,,,,,eu mi nulla ac enim in tempor turpis nec euismod scelerisque quam,2023-09-29,,2023
295,,,,,,,,,non lectus aliquam sit amet diam in magna bibendum imperdiet nullam orci pede venenatis non sodales sed tincidunt eu,2023-05-06,,2023
296,,,,,,,,,duis mattis egestas metus aenean fermentum donec ut mauris eget massa tempor convallis,2023-06-15,,2023
297,,,,,,,,,cubilia curae donec pharetra magna vestibulum aliquet ultrices erat tortor sollicitudin mi sit amet lobortis sapien sapien non,2023-10-04,,2023
298,,,,,,,,,leo rhoncus sed vestibulum sit amet cursus id turpis integer aliquet massa id lobortis convallis tortor risus,2023-07-15,,2023
299,,,,,,,,,venenatis tristique fusce congue diam id ornare imperdiet sapien urna pretium nisl ut volutpat sapien arcu sed augue aliquam,2023-07-12,,2023
300,,,,,,,,,odio consequat varius integer ac leo pellentesque ultrices mattis odio donec vitae nisi nam ultrices libero non mattis pulvinar nulla,2023-04-25,,2023
301,,,,,,,,,maecenas pulvinar lobortis est phasellus sit amet erat nulla tempus vivamus in felis eu sapien cursus vestibulum proin eu,2023-05-10,,2023
302,,,,,,,,,vivamus vestibulum sagittis sapien cum sociis natoque penatibus et magnis dis parturient montes nascetur,2023-05-11,,2023
303,,,,,,,,,aliquam convallis nunc proin at turpis a pede posuere nonummy integer non velit donec diam neque vestibulum eget vulputate ut,2023-11-23,,2023
304,,,,,,,,,cursus id turpis integer aliquet massa id lobortis convallis tortor risus dapibus augue,2023-08-27,,2023
305,,,,,,,,,nulla facilisi cras non velit nec nisi vulputate nonummy maecenas tincidunt lacus at velit vivamus vel nulla eget eros elementum,2023-11-30,,2023
306,,,,,,,,,diam cras pellentesque volutpat dui maecenas tristique est et tempus,2023-09-09,,2023
307,,,,,,,,,fusce consequat nulla nisl nunc nisl duis bibendum felis sed,2023-03-15,,2023
308,,,,,,,,,aliquam erat volutpat in congue etiam justo etiam pretium iaculis justo in hac habitasse,2023-04-02,,2023
309,,,,,,,,,id ornare imperdiet sapien urna pretium nisl ut volutpat sapien arcu sed augue aliquam,2023-07-28,,2023
310,,,,,,,,,quis orci eget orci vehicula condimentum curabitur in libero ut massa volutpat convallis morbi odio odio elementum eu,2023-09-05,,2023
311,,,,,,,,,in sapien iaculis congue vivamus metus arcu adipiscing molestie hendrerit at vulputate vitae nisl aenean lectus,2023-01-20,,2023
312,,,,,,,,,volutpat eleifend donec ut dolor morbi vel lectus in quam fringilla rhoncus mauris enim leo rhoncus sed,2023-09-08,,2023
313,,,,,,,,,nunc donec quis orci eget orci vehicula condimentum curabitur in libero ut massa volutpat convallis,2023-09-08,,2023
314,,,,,,,,,lectus aliquam sit amet diam in magna bibendum imperdiet nullam orci,2023-08-23,,2023
315,,,,,,,,,nisl duis ac nibh fusce lacus purus aliquet at feugiat non pretium quis lectus,2023-08-07,,2023
316,,,,,,,,,lacus at turpis donec posuere metus vitae ipsum aliquam non mauris morbi non lectus aliquam sit,2023-02-01,,2023
317,,,,,,,,,odio donec vitae nisi nam ultrices libero non mattis pulvinar nulla pede ullamcorper,2023-03-26,2024-02-08,2023
318,,,,,,,,,quam nec dui luctus rutrum nulla tellus in sagittis dui vel nisl duis ac nibh fusce lacus purus,2023-06-06,,2023
319,,,,,,,,,interdum venenatis turpis enim blandit mi in porttitor pede justo eu,2023-08-29,,2023
320,,,,,,,,,eu felis fusce posuere felis sed lacus morbi sem mauris laoreet ut rhoncus,2023-09-22,,2023
321,,,,,,,,,dapibus augue vel accumsan tellus nisi eu orci mauris lacinia sapien quis libero nullam sit amet turpis elementum ligula,2023-10-15,,2023
322,,,,,,,,,lectus in quam fringilla rhoncus mauris enim leo rhoncus sed vestibulum,2023-05-05,,2023
323,,,,,,,,,elit sodales scelerisque mauris sit amet eros suspendisse accumsan tortor quis turpis,2023-07-06,,2023
324,,,,,,,,,vel nulla eget eros elementum pellentesque quisque porta volutpat erat quisque erat,2023-01-27,,2023
325,,,,,,,,,justo eu massa donec dapibus duis at velit eu est congue elementum in,2023-12-28,,2023
326,,,,,,,,,libero nam dui proin leo odio porttitor id consequat in consequat ut nulla sed accumsan felis ut at dolor quis,2023-02-09,,2023
327,,,,,,,,,vivamus tortor duis mattis egestas metus aenean fermentum donec ut mauris eget massa,2023-11-20,,2023
328,,,,,,,,,eget eros elementum pellentesque quisque porta volutpat erat quisque erat eros viverra eget congue eget semper rutrum,2023-03-16,,2023
329,,,,,,,,,primis in faucibus orci luctus et ultrices posuere cubilia curae duis faucibus accumsan odio curabitur convallis duis consequat,2023-11-22,,2023
330,,,,,,,,,elementum ligula vehicula consequat morbi a ipsum integer a nibh in quis justo,2023-12-11,,2023
331,,,,,,,,,odio consequat varius integer ac leo pellentesque ultrices mattis odio donec vitae nisi nam ultrices libero non mattis pulvinar,2023-03-26,,2023
332,,,,,,,,,dui vel sem sed sagittis nam congue risus semper porta volutpat quam pede lobortis ligula sit amet eleifend pede,2023-07-28,,2023
333,,,,,,,,,id ligula suspendisse ornare consequat lectus in est risus auctor sed tristique in tempus sit,2023-12-22,,2023
334,,,,,,,,,tincidunt in leo maecenas pulvinar lobortis est phasellus sit amet erat nulla tempus vivamus in felis,2023-12-17,,2023
335,,,,,,,,,porttitor lacus at turpis donec posuere metus vitae ipsum aliquam non mauris morbi non lectus aliquam,2023-02-17,,2023
336,,,,,,,,,proin at turpis a pede posuere nonummy integer non velit donec diam,2023-09-27,,2023
337,,,,,,,,,pede justo eu massa donec dapibus duis at velit eu est congue elementum in hac,2023-09-26,,2023
338,,,,,,,,,pellentesque at nulla suspendisse potenti cras in purus eu magna vulputate luctus cum sociis natoque penatibus et,2023-07-14,,2023
339,,,,,,,,,sit amet eros suspendisse accumsan tortor quis turpis sed ante vivamus tortor duis mattis,2023-04-04,,2023
340,,,,,,,,,pellentesque volutpat dui maecenas tristique est et tempus semper est quam pharetra magna ac consequat,2023-06-20,,2023
341,,,,,,,,,turpis eget elit sodales scelerisque mauris sit amet eros suspendisse accumsan tortor quis turpis,2023-11-12,,2023
342,,,,,,,,,sit amet sem fusce consequat nulla nisl nunc nisl duis bibendum,2023-06-07,,2023
343,,,,,,,,,nulla ac enim in tempor turpis nec euismod scelerisque quam turpis adipiscing lorem vitae mattis,2023-09-02,,2023
344,,,,,,,,,ultrices posuere cubilia curae donec pharetra magna vestibulum aliquet ultrices erat tortor sollicitudin mi sit amet lobortis sapien sapien non,2023-01-18,,2023
345,,,,,,,,,ipsum primis in faucibus orci luctus et ultrices posuere cubilia curae donec,2023-06-17,,2023
346,,,,,,,,,orci luctus et ultrices posuere cubilia curae donec pharetra magna vestibulum,2023-10-11,,2023
347,,,,,,,,,diam erat fermentum justo nec condimentum neque sapien placerat ante nulla justo aliquam quis turpis eget,2023-03-29,,2023
348,,,,,,,,,auctor gravida sem praesent id massa id nisl venenatis lacinia,2023-09-06,,2023
349,,,,,,,,,aenean sit amet justo morbi ut odio cras mi pede malesuada in imperdiet et commodo vulputate justo in blandit,2023-10-02,,2023
350,,,,,,,,,ut ultrices vel augue vestibulum ante ipsum primis in faucibus orci luctus et ultrices posuere,2023-03-15,,2023
351,,,,,,,,,vehicula condimentum curabitur in libero ut massa volutpat convallis morbi odio odio,2023-08-22,,2023
352,,,,,,,,,parturient montes nascetur ridiculus mus etiam vel augue vestibulum rutrum rutrum,2023-10-10,,2023
353,,,,,,,,,nisl nunc nisl duis bibendum felis sed interdum venenatis turpis enim blandit mi in porttitor pede,2023-01-31,,2023
354,,,,,,,,,montes nascetur ridiculus mus etiam vel augue vestibulum rutrum rutrum neque aenean auctor gravida sem praesent id massa,2023-12-22,,2023
355,,,,,,,,,lorem ipsum dolor sit amet consectetuer adipiscing elit proin risus praesent lectus,2023-03-29,,2023
356,,,,,,,,,augue luctus tincidunt nulla mollis molestie lorem quisque ut erat curabitur gravida nisi at,2023-12-26,,2023
357,,,,,,,,,accumsan odio curabitur convallis duis consequat dui nec nisi volutpat eleifend donec ut dolor morbi vel lectus in quam fringilla,2023-06-04,,2023
358,,,,,,,,,vitae nisi nam ultrices libero non mattis pulvinar nulla pede ullamcorper augue a suscipit nulla elit ac nulla sed vel,2023-06-21,,2023
359,,,,,,,,,tellus in sagittis dui vel nisl duis ac nibh fusce lacus purus aliquet at feugiat non,2023-10-30,,2023
360,,,,,,,,,in tempor turpis nec euismod scelerisque quam turpis adipiscing lorem vitae mattis nibh ligula nec sem duis aliquam convallis,2023-02-18,,2023
361,,,,,,,,,in tempor turpis nec euismod scelerisque quam turpis adipiscing lorem vitae mattis nibh ligula nec sem duis,2023-12-23,,2023
362,,,,,,,,,in faucibus orci luctus et ultrices posuere cubilia curae mauris viverra diam vitae quam suspendisse potenti nullam porttitor lacus,2023-04-26,,2023
363,,,,,,,,,bibendum imperdiet nullam orci pede venenatis non sodales sed tincidunt eu felis fusce posuere,2023-03-05,,2023
364,,,,,,,,,dolor quis odio consequat varius integer ac leo pellentesque ultrices mattis odio donec vitae nisi nam,2023-03-11,,2023
365,,,,,,,,,sagittis dui vel nisl duis ac nibh fusce lacus purus aliquet at,2023-04-11,,2023
366,,,,,,,,,suspendisse ornare consequat lectus in est risus auctor sed tristique in tempus sit amet sem,2023-06-17,,2023
367,,,,,,,,,nunc donec quis orci eget orci vehicula condimentum curabitur in libero ut massa,2023-11-02,,2023
368,,,,,,,,,eget rutrum at lorem integer tincidunt ante vel ipsum praesent blandit lacinia erat vestibulum,2023-02-19,,2023
369,,,,,,,,,vel est donec odio justo sollicitudin ut suscipit a feugiat et eros vestibulum ac est lacinia nisi,2023-02-15,,2023
370,,,,,,,,,in imperdiet et commodo vulputate justo in blandit ultrices enim,2023-11-15,,2023
371,,,,,,,,,amet eleifend pede libero quis orci nullam molestie nibh in lectus pellentesque at,2023-10-10,,2023
372,,,,,,,,,dictumst etiam faucibus cursus urna ut tellus nulla ut erat id mauris vulputate elementum nullam,2023-12-08,,2023
373,,,,,,,,,curabitur in libero ut massa volutpat convallis morbi odio odio elementum eu interdum eu tincidunt in leo maecenas pulvinar,2023-08-28,,2023
374,,,,,,,,,semper sapien a libero nam dui proin leo odio porttitor id,2023-06-26,,2023
375,,,,,,,,,augue vestibulum rutrum rutrum neque aenean auctor gravida sem praesent,2023-04-09,,2023
376,,,,,,,,,maecenas ut massa quis augue luctus tincidunt nulla mollis molestie,2023-11-26,,2023
377,,,,,,,,,libero ut massa volutpat convallis morbi odio odio elementum eu interdum eu,2023-11-24,,2023
378,,,,,,,,,aliquet at feugiat non pretium quis lectus suspendisse potenti in eleifend quam a odio in,2023-03-10,,2023
379,,,,,,,,,a ipsum integer a nibh in quis justo maecenas rhoncus aliquam lacus morbi quis tortor id nulla,2023-10-07,,2023
380,,,,,,,,,nulla eget eros elementum pellentesque quisque porta volutpat erat quisque erat eros viverra eget,2023-09-14,,2023
381,,,,,,,,,ridiculus mus etiam vel augue vestibulum rutrum rutrum neque aenean auctor gravida sem praesent id massa id nisl venenatis lacinia,2023-02-02,,2023
382,,,,,,,,,porta volutpat quam pede lobortis ligula sit amet eleifend pede libero quis orci nullam molestie nibh in lectus pellentesque,2023-12-17,,2023
383,,,,,,,,,nullam orci pede venenatis non sodales sed tincidunt eu felis fusce posuere felis sed lacus morbi sem mauris laoreet ut,2023-10-30,,2023
384,,,,,,,,,morbi quis tortor id nulla ultrices aliquet maecenas leo odio condimentum id luctus nec molestie sed justo,2023-06-15,,2023
385,,,,,,,,,ut massa volutpat convallis morbi odio odio elementum eu interdum eu tincidunt in leo maecenas pulvinar lobortis,2023-10-10,,2023
386,,,,,,,,,ornare consequat lectus in est risus auctor sed tristique in,2023-03-05,,2023
387,,,,,,,,,semper rutrum nulla nunc purus phasellus in felis donec semper sapien,2023-02-24,,2023
388,,,,,,,,,hac habitasse platea dictumst morbi vestibulum velit id pretium iaculis diam,2023-11-23,,2023
389,,,,,,,,,suscipit ligula in lacus curabitur at ipsum ac tellus semper interdum mauris ullamcorper purus sit amet,2023-09-14,,2023
390,,,,,,,,,id consequat in consequat ut nulla sed accumsan felis ut at dolor quis odio consequat varius integer ac,2023-10-05,,2023
391,,,,,,,,,in blandit ultrices enim lorem ipsum dolor sit amet consectetuer adipiscing elit proin interdum mauris non ligula pellentesque,2023-04-19,,2023
392,,,,,,,,,magnis dis parturient montes nascetur ridiculus mus etiam vel augue vestibulum rutrum rutrum neque aenean auctor gravida sem praesent,2023-11-08,,2023
393,,,,,,,,,pede posuere nonummy integer non velit donec diam neque vestibulum eget vulputate ut ultrices,2023-06-11,,2023
394,,,,,,,,,in faucibus orci luctus et ultrices posuere cubilia curae donec pharetra magna vestibulum aliquet,2023-06-05,,2023
395,,,,,,,,,neque aenean auctor gravida sem praesent id massa id nisl venenatis lacinia aenean,2023-04-16,,2023
396,,,,,,,,,tristique in tempus sit amet sem fusce consequat nulla nisl nunc nisl duis bibendum felis sed interdum venenatis,2023-07-18,,2023
397,,,,,,,,,aenean auctor gravida sem praesent id massa id nisl venenatis lacinia aenean sit amet justo morbi ut odio cras,2023-01-03,,2023
398,,,,,,,,,in leo maecenas pulvinar lobortis est phasellus sit amet erat nulla tempus vivamus in felis eu,2023-04-10,,2023
399,,,,,,,,,accumsan tellus nisi eu orci mauris lacinia sapien quis libero nullam sit amet,2023-03-26,,2023
400,,,,,,,,,tellus in sagittis dui vel nisl duis ac nibh fusce lacus purus aliquet at feugiat non,2023-04-02,,2023
401,,,,,,,,,at dolor quis odio consequat varius integer ac leo pellentesque ultrices mattis odio donec vitae nisi nam,2023-05-17,,2023
402,,,,,,,,,interdum mauris non ligula pellentesque ultrices phasellus id sapien in sapien iaculis congue vivamus metus arcu adipiscing,2023-03-02,,2023
403,,,,,,,,,posuere cubilia curae donec pharetra magna vestibulum aliquet ultrices erat tortor sollicitudin mi sit amet lobortis sapien sapien,2023-06-10,,2023
404,,,,,,,,,aliquet massa id lobortis convallis tortor risus dapibus augue vel accumsan tellus nisi eu orci mauris,2023-01-14,,2023
405,,,,,,,,,orci pede venenatis non sodales sed tincidunt eu felis fusce posuere felis sed lacus morbi sem mauris,2023-03-13,,2023
406,,,,,,,,,morbi a ipsum integer a nibh in quis justo maecenas rhoncus aliquam lacus,2023-06-24,,2023
407,,,,,,,,,nulla ultrices aliquet maecenas leo odio condimentum id luctus nec molestie sed justo pellentesque viverra pede ac diam,2023-02-12,,2023
408,,,,,,,,,in tempus sit amet sem fusce consequat nulla nisl nunc nisl duis bibendum felis sed,2023-10-02,,2023
409,,,,,,,,,vulputate vitae nisl aenean lectus pellentesque eget nunc donec quis orci eget orci vehicula condimentum curabitur in libero,2023-01-12,,2023
410,,,,,,,,,massa id nisl venenatis lacinia aenean sit amet justo morbi ut odio cras mi pede,2023-10-19,,2023
411,,,,,,,,,sapien cum sociis natoque penatibus et magnis dis parturient montes nascetur ridiculus mus etiam vel augue vestibulum rutrum,2023-06-30,,2023
412,,,,,,,,,faucibus cursus urna ut tellus nulla ut erat id mauris vulputate elementum nullam,2023-07-24,,2023
413,,,,,,,,,vulputate luctus cum sociis natoque penatibus et magnis dis parturient,2023-03-03,,2023
414,,,,,,,,,praesent id massa id nisl venenatis lacinia aenean sit amet justo morbi ut odio cras mi pede,2023-02-26,,2023
415,,,,,,,,,orci luctus et ultrices posuere cubilia curae nulla dapibus dolor vel est donec,2023-01-12,,2023
416,,,,,,,,,ultrices vel augue vestibulum ante ipsum primis in faucibus orci luctus et ultrices posuere,2023-08-25,,2023
417,,,,,,,,,nulla nisl nunc nisl duis bibendum felis sed interdum venenatis turpis enim blandit mi in porttitor pede justo eu massa,2023-10-30,,2023
