idnota,fk_idalumno_nota,fk_idmateriacurso_nota,nota1_nota,nota2_nota,nota3_nota,notadic_nota,notafeb_nota,notadef_nota,obs_nota,createdAt,updatedAt,ciclo_lectivo_nota
1,,,,,,,,,integer a nibh in quis justo maecenas rhoncus aliquam lacus morbi quis tortor id nulla ultrices aliquet maecenas leo odio,2023-06-13,,2023
2,,,,,,,,,est congue elementum in hac habitasse platea dictumst morbi vestibulum velit id pretium iaculis diam erat fermentum justo nec,2023-01-21,,2023
3,,,,,,,,,libero nullam sit amet turpis elementum ligula vehicula consequat morbi a ipsum integer a nibh in,2023-09-18,,2023
4,,,,,,,,,augue a suscipit nulla elit ac nulla sed vel enim sit amet nunc viverra dapibus nulla suscipit ligula in,2023-08-08,,2023
5,,,,,,,,,ultrices libero non mattis pulvinar nulla pede ullamcorper augue a suscipit nulla elit ac nulla sed vel enim sit,2023-05-13,,2023
6,,,,,,,,,diam erat fermentum justo nec condimentum neque sapien placerat ante nulla justo aliquam quis turpis eget elit,2023-08-06,,2023
7,,,,,,,,,duis mattis egestas metus aenean fermentum donec ut mauris eget massa tempor convallis nulla neque libero,2023-05-09,,2023
8,,,,,,,,,orci luctus et ultrices posuere cubilia curae nulla dapibus dolor vel est donec odio justo sollicitudin ut suscipit,2023-05-07,,2023
9,,,,,,,,,pede posuere nonummy integer non velit donec diam neque vestibulum,2023-04-03,,2023
10,,,,,,,,,nisi venenatis tristique fusce congue diam id ornare imperdiet sapien urna pretium nisl ut volutpat sapien arcu sed augue aliquam,2023-02-03,,2023
11,,,,,,,,,semper sapien a libero nam dui proin leo odio porttitor id consequat in consequat ut nulla,2023-02-03,,2023
12,,,,,,,,,sem sed sagittis nam congue risus semper porta volutpat quam pede lobortis ligula,2023-12-26,,2023
13,,,,,,,,,euismod scelerisque quam turpis adipiscing lorem vitae mattis nibh ligula nec sem duis aliquam convallis nunc proin,2023-10-06,,2023
14,,,,,,,,,et tempus semper est quam pharetra magna ac consequat metus sapien ut nunc vestibulum ante,2023-05-03,,2023
15,,,,,,,,,elit proin risus praesent lectus vestibulum quam sapien varius ut blandit non interdum in ante vestibulum ante,2023-12-10,,2023
16,,,,,,,,,nibh quisque id justo sit amet sapien dignissim vestibulum vestibulum ante ipsum primis in faucibus orci luctus et ultrices posuere,2023-01-29,,2023
17,,,,,,,,,sed vel enim sit amet nunc viverra dapibus nulla suscipit ligula in lacus curabitur at ipsum,2023-04-15,,2023
18,,,,,,,,,orci eget orci vehicula condimentum curabitur in libero ut massa volutpat convallis morbi odio odio elementum eu interdum eu tincidunt,2023-11-07,,2023
19,,,,,,,,,eleifend luctus ultricies eu nibh quisque id justo sit amet sapien dignissim vestibulum vestibulum ante ipsum,2023-03-04,,2023
20,,,,,,,,,convallis nulla neque libero convallis eget eleifend luctus ultricies eu nibh quisque id justo,2023-01-12,,2023
21,,,,,,,,,eu orci mauris lacinia sapien quis libero nullam sit amet turpis,2023-01-18,,2023
22,,,,,,,,,luctus rutrum nulla tellus in sagittis dui vel nisl duis ac nibh fusce lacus purus aliquet at feugiat,2023-02-21,,2023
23,,,,,,,,,pede malesuada in imperdiet et commodo vulputate justo in blandit ultrices enim,2023-10-17,,2023
24,,,,,,,,,est quam pharetra magna ac consequat metus sapien ut nunc vestibulum ante,2023-12-28,,2023
25,,,,,,,,,sit amet erat nulla tempus vivamus in felis eu sapien cursus,2023-09-20,,2023
26,,,,,,,,,eu nibh quisque id justo sit amet sapien dignissim vestibulum vestibulum ante ipsum primis in,2023-09-09,,2023
27,,,,,,,,,pede lobortis ligula sit amet eleifend pede libero quis orci nullam molestie nibh in,2023-02-14,,2023
28,,,,,,,,,sapien cursus vestibulum proin eu mi nulla ac enim in tempor turpis nec euismod scelerisque quam turpis adipiscing lorem vitae,2023-09-21,,2023
29,,,,,,,,,vestibulum ac est lacinia nisi venenatis tristique fusce congue diam id,2023-10-25,,2023
30,,,,,,,,,ultrices erat tortor sollicitudin mi sit amet lobortis sapien sapien non mi integer ac,2023-10-18,,2023
31,,,,,,,,,ligula in lacus curabitur at ipsum ac tellus semper interdum,2023-03-03,,2023
32,,,,,,,,,id nisl venenatis lacinia aenean sit amet justo morbi ut odio cras mi pede malesuada in imperdiet et,2023-06-20,,2023
33,,,,,,,,,vel nisl duis ac nibh fusce lacus purus aliquet at feugiat non pretium quis lectus suspendisse potenti in,2023-09-07,,2023
34,,,,,,,,,quisque ut erat curabitur gravida nisi at nibh in hac habitasse platea dictumst aliquam augue quam sollicitudin,2023-06-23,,2023
35,,,,,,,,,amet cursus id turpis integer aliquet massa id lobortis convallis tortor risus dapibus augue vel accumsan tellus nisi,2023-01-18,,2023
36,,,,,,,,,quisque ut erat curabitur gravida nisi at nibh in hac,2023-02-14,,2023
37,,,,,,,,,ut nulla sed accumsan felis ut at dolor quis odio consequat varius integer ac leo pellentesque ultrices mattis,2023-11-28,,2023
38,,,,,,,,,est risus auctor sed tristique in tempus sit amet sem fusce consequat nulla nisl,2023-08-25,,2023
39,,,,,,,,,eu felis fusce posuere felis sed lacus morbi sem mauris laoreet ut rhoncus aliquet pulvinar sed nisl,2023-11-01,,2023
40,,,,,,,,,vehicula consequat morbi a ipsum integer a nibh in quis justo maecenas,2023-01-08,,2023
41,,,,,,,,,tincidunt eu felis fusce posuere felis sed lacus morbi sem mauris laoreet ut rhoncus aliquet pulvinar sed,2023-01-19,,2023
42,,,,,,,,,amet nunc viverra dapibus nulla suscipit ligula in lacus curabitur at ipsum ac tellus semper interdum mauris ullamcorper,2023-04-14,,2023
43,,,,,,,,,eleifend quam a odio in hac habitasse platea dictumst maecenas ut,2023-10-31,,2023
44,,,,,,,,,volutpat quam pede lobortis ligula sit amet eleifend pede libero quis,2023-12-24,,2023
45,,,,,,,,,tortor id nulla ultrices aliquet maecenas leo odio condimentum id luctus nec molestie sed justo pellentesque,2023-02-25,,2023
46,,,,,,,,,velit id pretium iaculis diam erat fermentum justo nec condimentum neque sapien placerat ante nulla justo aliquam quis,2023-11-22,,2023
47,,,,,,,,,nibh in lectus pellentesque at nulla suspendisse potenti cras in,2023-09-03,,2023
48,,,,,,,,,feugiat et eros vestibulum ac est lacinia nisi venenatis tristique fusce congue diam id ornare imperdiet sapien urna pretium,2023-05-14,,2023
49,,,,,,,,,sit amet nulla quisque arcu libero rutrum ac lobortis vel dapibus at diam nam tristique tortor eu,2023-10-13,,2023
50,,,,,,,,,ultrices enim lorem ipsum dolor sit amet consectetuer adipiscing elit proin interdum mauris non ligula pellentesque,2023-12-29,,2023
51,,,,,,,,,feugiat non pretium quis lectus suspendisse potenti in eleifend quam a odio in hac,2023-10-15,,2023
52,,,,,,,,,eget orci vehicula condimentum curabitur in libero ut massa volutpat convallis,2023-05-21,,2023
53,,,,,,,,,quam pede lobortis ligula sit amet eleifend pede libero quis orci nullam molestie nibh in lectus pellentesque at,2023-01-14,,2023
54,,,,,,,,,tellus nulla ut erat id mauris vulputate elementum nullam varius nulla facilisi cras non velit nec nisi vulputate,2023-06-29,,2023
55,,,,,,,,,feugiat et eros vestibulum ac est lacinia nisi venenatis tristique fusce congue diam id,2023-09-16,,2023
56,,,,,,,,,donec odio justo sollicitudin ut suscipit a feugiat et eros vestibulum ac est lacinia nisi venenatis tristique fusce congue,2023-07-22,,2023
57,,,,,,,,,dictumst morbi vestibulum velit id pretium iaculis diam erat fermentum justo nec condimentum neque sapien placerat ante,2023-10-17,,2023
58,,,,,,,,,praesent blandit lacinia erat vestibulum sed magna at nunc commodo placerat praesent blandit nam,2023-09-24,,2023
59,,,,,,,,,et ultrices posuere cubilia curae mauris viverra diam vitae quam suspendisse potenti nullam porttitor lacus at turpis donec posuere,2023-02-16,,2023
60,,,,,,,,,sed magna at nunc commodo placerat praesent blandit nam nulla integer pede justo lacinia eget tincidunt eget tempus vel,2023-06-30,,2023
61,,,,,,,,,id sapien in sapien iaculis congue vivamus metus arcu adipiscing molestie hendrerit at vulputate vitae nisl,2023-08-10,,2023
62,,,,,,,,,mattis pulvinar nulla pede ullamcorper augue a suscipit nulla elit ac,2023-01-10,,2023
63,,,,,,,,,pellentesque at nulla suspendisse potenti cras in purus eu magna vulputate,2023-01-24,,2023
64,,,,,,,,,luctus et ultrices posuere cubilia curae nulla dapibus dolor vel est donec odio justo sollicitudin ut suscipit a feugiat,2023-06-12,,2023
65,,,,,,,,,congue vivamus metus arcu adipiscing molestie hendrerit at vulputate vitae nisl aenean,2023-04-19,,2023
66,,,,,,,,,nisl duis bibendum felis sed interdum venenatis turpis enim blandit mi in porttitor pede justo eu massa donec dapibus,2023-02-26,,2023
67,,,,,,,,,quisque id justo sit amet sapien dignissim vestibulum vestibulum ante ipsum primis in faucibus orci,2023-08-07,,2023
68,,,,,,,,,morbi quis tortor id nulla ultrices aliquet maecenas leo odio,2023-05-17,,2023
69,,,,,,,,,volutpat dui maecenas tristique est et tempus semper est quam pharetra magna ac consequat metus sapien ut nunc vestibulum,2023-10-08,,2023
70,,,,,,,,,in ante vestibulum ante ipsum primis in faucibus orci luctus et,2023-01-19,,2023
71,,,,,,,,,consequat varius integer ac leo pellentesque ultrices mattis odio donec vitae nisi nam,2023-05-14,,2023
72,,,,,,,,,justo aliquam quis turpis eget elit sodales scelerisque mauris sit amet eros suspendisse,2023-06-06,,2023
73,,,,,,,,,cubilia curae mauris viverra diam vitae quam suspendisse potenti nullam porttitor lacus at,2023-09-17,,2023
74,,,,,,,,,elementum eu interdum eu tincidunt in leo maecenas pulvinar lobortis est phasellus,2023-05-08,,2023
75,,,,,,,,,arcu libero rutrum ac lobortis vel dapibus at diam nam tristique tortor eu pede,2023-07-05,,2023
76,,,,,,,,,curabitur at ipsum ac tellus semper interdum mauris ullamcorper purus sit amet nulla quisque arcu libero rutrum ac lobortis vel,2023-09-24,,2023
77,,,,,,,,,tristique in tempus sit amet sem fusce consequat nulla nisl nunc nisl duis bibendum felis sed interdum venenatis,2023-03-01,,2023
78,,,,,,,,,primis in faucibus orci luctus et ultrices posuere cubilia curae,2023-08-07,,2023
79,,,,,,,,,justo eu massa donec dapibus duis at velit eu est,2023-12-15,,2023
80,,,,,,,,,morbi vel lectus in quam fringilla rhoncus mauris enim leo rhoncus sed vestibulum,2023-07-26,,2023
81,,,,,,,,,diam in magna bibendum imperdiet nullam orci pede venenatis non sodales,2023-03-19,,2023
82,,,,,,,,,morbi vel lectus in quam fringilla rhoncus mauris enim leo rhoncus sed vestibulum sit amet cursus id turpis integer aliquet,2023-03-01,,2023
83,,,,,,,,,rhoncus dui vel sem sed sagittis nam congue risus semper porta volutpat quam pede lobortis ligula sit amet,2023-04-09,,2023
84,,,,,,,,,quam pharetra magna ac consequat metus sapien ut nunc vestibulum ante,2023-04-10,,2023
85,,,,,,,,,habitasse platea dictumst morbi vestibulum velit id pretium iaculis diam erat fermentum justo nec condimentum neque,2023-06-08,,2023
86,,,,,,,,,sagittis sapien cum sociis natoque penatibus et magnis dis parturient montes nascetur ridiculus mus etiam,2023-01-23,,2023
87,,,,,,,,,blandit nam nulla integer pede justo lacinia eget tincidunt eget tempus vel pede morbi porttitor lorem,2023-10-26,,2023
88,,,,,,,,,nam ultrices libero non mattis pulvinar nulla pede ullamcorper augue,2023-01-15,,2023
89,,,,,,,,,magna ac consequat metus sapien ut nunc vestibulum ante ipsum primis in faucibus orci,2023-06-24,,2023
90,,,,,,,,,aenean lectus pellentesque eget nunc donec quis orci eget orci vehicula condimentum curabitur in libero ut massa volutpat convallis morbi,2023-11-02,,2023
91,,,,,,,,,dignissim vestibulum vestibulum ante ipsum primis in faucibus orci luctus et ultrices posuere cubilia curae nulla,2023-06-16,,2023
92,,,,,,,,,vel augue vestibulum rutrum rutrum neque aenean auctor gravida sem praesent id massa id nisl venenatis lacinia aenean,2023-06-28,,2023
93,,,,,,,,,non quam nec dui luctus rutrum nulla tellus in sagittis dui vel nisl duis ac nibh fusce lacus,2023-01-15,,2023
94,,,,,,,,,mi pede malesuada in imperdiet et commodo vulputate justo in blandit ultrices enim lorem ipsum dolor sit amet,2023-06-27,,2023
95,,,,,,,,,nulla ac enim in tempor turpis nec euismod scelerisque quam turpis adipiscing,2023-08-12,,2023
96,,,,,,,,,donec semper sapien a libero nam dui proin leo odio porttitor id consequat in consequat ut nulla,2023-05-12,,2023
97,,,,,,,,,pellentesque volutpat dui maecenas tristique est et tempus semper est quam pharetra magna ac consequat metus sapien,2023-11-27,,2023
98,,,,,,,,,vestibulum ante ipsum primis in faucibus orci luctus et ultrices posuere cubilia curae mauris,2023-10-01,,2023
99,,,,,,,,,est lacinia nisi venenatis tristique fusce congue diam id ornare imperdiet sapien,2023-11-06,,2023
100,,,,,,,,,lobortis ligula sit amet eleifend pede libero quis orci nullam,2023-12-19,,2023
101,,,,,,,,,in tempor turpis nec euismod scelerisque quam turpis adipiscing lorem,2023-05-21,,2023
102,,,,,,,,,nibh in quis justo maecenas rhoncus aliquam lacus morbi quis tortor id nulla ultrices aliquet maecenas,2023-11-09,,2023
103,,,,,,,,,ac est lacinia nisi venenatis tristique fusce congue diam id ornare imperdiet sapien urna pretium nisl ut volutpat sapien,2023-10-03,,2023
104,,,,,,,,,vestibulum sit amet cursus id turpis integer aliquet massa id lobortis,2023-12-08,,2023
105,,,,,,,,,donec pharetra magna vestibulum aliquet ultrices erat tortor sollicitudin mi sit amet lobortis,2023-03-13,,2023
106,,,,,,,,,sit amet consectetuer adipiscing elit proin interdum mauris non ligula pellentesque ultrices phasellus id,2023-04-20,,2023
107,,,,,,,,,rutrum ac lobortis vel dapibus at diam nam tristique tortor,2023-11-19,,2023
108,,,,,,,,,nascetur ridiculus mus etiam vel augue vestibulum rutrum rutrum neque aenean auctor gravida sem praesent id massa id,2023-03-09,,2023
109,,,,,,,,,platea dictumst morbi vestibulum velit id pretium iaculis diam erat fermentum justo nec condimentum neque,2023-12-24,,2023
110,,,,,,,,,vel ipsum praesent blandit lacinia erat vestibulum sed magna at nunc commodo placerat praesent blandit,2023-06-11,,2023
111,,,,,,,,,semper interdum mauris ullamcorper purus sit amet nulla quisque arcu libero rutrum ac lobortis vel,2023-12-12,,2023
112,,,,,,,,,vel lectus in quam fringilla rhoncus mauris enim leo rhoncus,2023-05-23,,2023
113,,,,,,,,,porttitor pede justo eu massa donec dapibus duis at velit eu est congue elementum in hac,2023-09-25,,2023
114,,,,,,,,,sed tristique in tempus sit amet sem fusce consequat nulla nisl nunc nisl duis bibendum felis sed interdum,2023-07-24,,2023
115,,,,,,,,,libero nam dui proin leo odio porttitor id consequat in consequat ut nulla sed,2023-01-14,,2023
116,,,,,,,,,velit id pretium iaculis diam erat fermentum justo nec condimentum neque,2023-10-21,,2023
117,,,,,,,,,etiam faucibus cursus urna ut tellus nulla ut erat id mauris,2023-09-08,,2023
118,,,,,,,,,vivamus tortor duis mattis egestas metus aenean fermentum donec ut mauris eget massa tempor convallis nulla neque libero convallis,2023-04-27,,2023
119,,,,,,,,,praesent id massa id nisl venenatis lacinia aenean sit amet justo morbi ut odio,2023-10-19,,2023
120,,,,,,,,,neque duis bibendum morbi non quam nec dui luctus rutrum nulla tellus,2023-08-31,,2023
121,,,,,,,,,ut blandit non interdum in ante vestibulum ante ipsum primis in faucibus,2023-03-24,,2023
122,,,,,,,,,mauris laoreet ut rhoncus aliquet pulvinar sed nisl nunc rhoncus,2023-06-05,,2023
123,,,,,,,,,sem praesent id massa id nisl venenatis lacinia aenean sit amet justo morbi ut,2023-01-23,,2023
124,,,,,,,,,suspendisse ornare consequat lectus in est risus auctor sed tristique in tempus sit,2023-10-08,,2023
125,,,,,,,,,maecenas leo odio condimentum id luctus nec molestie sed justo pellentesque viverra pede ac diam cras pellentesque volutpat dui,2023-12-16,,2023
126,,,,,,,,,convallis duis consequat dui nec nisi volutpat eleifend donec ut dolor morbi vel,2023-10-04,,2023
127,,,,,,,,,erat fermentum justo nec condimentum neque sapien placerat ante nulla justo aliquam quis turpis eget elit sodales,2023-09-18,,2023
128,,,,,,,,,tincidunt lacus at velit vivamus vel nulla eget eros elementum pellentesque quisque porta volutpat erat quisque erat eros,2023-11-28,,2023
129,,,,,,,,,dis parturient montes nascetur ridiculus mus vivamus vestibulum sagittis sapien cum sociis,2023-09-07,,2023
130,,,,,,,,,vestibulum rutrum rutrum neque aenean auctor gravida sem praesent id massa,2023-09-10,,2023
131,,,,,,,,,lectus pellentesque at nulla suspendisse potenti cras in purus eu magna vulputate luctus cum sociis natoque penatibus,2023-01-27,,2023
132,,,,,,,,,etiam faucibus cursus urna ut tellus nulla ut erat id mauris vulputate,2023-05-20,,2023
133,,,,,,,,,non mauris morbi non lectus aliquam sit amet diam in magna bibendum imperdiet nullam,2023-05-18,,2023
134,,,,,,,,,id massa id nisl venenatis lacinia aenean sit amet justo morbi ut odio cras mi,2023-03-09,,2023
135,,,,,,,,,sapien non mi integer ac neque duis bibendum morbi non quam nec,2023-01-29,,2023
136,,,,,,,,,duis aliquam convallis nunc proin at turpis a pede posuere nonummy integer non velit donec diam,2023-06-19,,2023
137,,,,,,,,,luctus et ultrices posuere cubilia curae nulla dapibus dolor vel est donec odio justo,2023-01-18,,2023
138,,,,,,,,,felis fusce posuere felis sed lacus morbi sem mauris laoreet ut rhoncus aliquet pulvinar sed,2023-08-20,,2023
139,,,,,,,,,consequat nulla nisl nunc nisl duis bibendum felis sed interdum venenatis,2023-05-17,,2023
140,,,,,,,,,massa tempor convallis nulla neque libero convallis eget eleifend luctus ultricies eu,2023-05-04,,2023
141,,,,,,,,,sagittis sapien cum sociis natoque penatibus et magnis dis parturient montes nascetur ridiculus mus etiam vel augue,2023-07-25,,2023
142,,,,,,,,,proin at turpis a pede posuere nonummy integer non velit donec diam,2023-08-26,,2023
143,,,,,,,,,amet consectetuer adipiscing elit proin risus praesent lectus vestibulum quam sapien varius ut,2023-11-14,,2023
144,,,,,,,,,posuere cubilia curae duis faucibus accumsan odio curabitur convallis duis consequat dui nec nisi,2023-05-17,,2023
145,,,,,,,,,vehicula condimentum curabitur in libero ut massa volutpat convallis morbi odio odio elementum eu interdum eu tincidunt in leo,2023-11-08,,2023
146,,,,,,,,,molestie lorem quisque ut erat curabitur gravida nisi at nibh in hac,2023-07-04,,2023
147,,,,,,,,,sit amet erat nulla tempus vivamus in felis eu sapien cursus vestibulum proin,2023-02-13,,2023
148,,,,,,,,,lectus suspendisse potenti in eleifend quam a odio in hac habitasse platea dictumst maecenas ut massa quis augue luctus tincidunt,2023-04-16,,2023
149,,,,,,,,,primis in faucibus orci luctus et ultrices posuere cubilia curae mauris viverra diam vitae quam suspendisse,2023-02-18,,2023
150,,,,,,,,,posuere cubilia curae donec pharetra magna vestibulum aliquet ultrices erat,2023-09-02,,2023
151,,,,,,,,,congue elementum in hac habitasse platea dictumst morbi vestibulum velit id pretium iaculis diam erat,2023-12-29,,2023
152,,,,,,,,,phasellus in felis donec semper sapien a libero nam dui proin leo odio,2023-07-13,,2023
153,,,,,,,,,faucibus orci luctus et ultrices posuere cubilia curae duis faucibus,2023-07-07,,2023
154,,,,,,,,,non quam nec dui luctus rutrum nulla tellus in sagittis dui vel nisl,2023-02-17,,2023
155,,,,,,,,,donec posuere metus vitae ipsum aliquam non mauris morbi non lectus aliquam sit amet diam,2023-01-06,,2023
156,,,,,,,,,nulla elit ac nulla sed vel enim sit amet nunc viverra dapibus nulla suscipit ligula in lacus,2023-04-01,,2023
157,,,,,,,,,non ligula pellentesque ultrices phasellus id sapien in sapien iaculis congue vivamus metus arcu adipiscing molestie hendrerit at vulputate,2023-11-20,2024-01-15,2023
158,,,,,,,,,sit amet eleifend pede libero quis orci nullam molestie nibh,2023-12-18,,2023
159,,,,,,,,,posuere cubilia curae duis faucibus accumsan odio curabitur convallis duis,2023-05-15,,2023
160,,,,,,,,,habitasse platea dictumst maecenas ut massa quis augue luctus tincidunt nulla mollis molestie lorem quisque ut,2023-05-14,,2023
161,,,,,,,,,elementum pellentesque quisque porta volutpat erat quisque erat eros viverra eget congue eget semper rutrum nulla nunc purus phasellus in,2023-12-08,,2023
162,,,,,,,,,est donec odio justo sollicitudin ut suscipit a feugiat et eros vestibulum ac est lacinia nisi venenatis tristique fusce,2023-06-10,,2023
163,,,,,,,,,ligula vehicula consequat morbi a ipsum integer a nibh in quis justo maecenas rhoncus aliquam lacus,2023-02-13,,2023
164,,,,,,,,,amet consectetuer adipiscing elit proin risus praesent lectus vestibulum quam sapien varius ut blandit,2023-07-20,,2023
165,,,,,,,,,nisl venenatis lacinia aenean sit amet justo morbi ut odio cras,2023-11-04,,2023
166,,,,,,,,,nibh in quis justo maecenas rhoncus aliquam lacus morbi quis tortor id nulla ultrices aliquet,2023-07-26,,2023
167,,,,,,,,,dolor morbi vel lectus in quam fringilla rhoncus mauris enim leo rhoncus sed vestibulum sit amet cursus id turpis integer,2023-09-03,,2023
168,,,,,,,,,fusce posuere felis sed lacus morbi sem mauris laoreet ut rhoncus aliquet pulvinar,2023-08-16,,2023
169,,,,,,,,,duis aliquam convallis nunc proin at turpis a pede posuere nonummy integer non velit donec,2023-07-11,,2023
170,,,,,,,,,placerat ante nulla justo aliquam quis turpis eget elit sodales,2023-09-23,,2023
171,,,,,,,,,dolor sit amet consectetuer adipiscing elit proin risus praesent lectus vestibulum quam sapien varius ut blandit non interdum in,2023-03-22,,2023
172,,,,,,,,,nisl duis bibendum felis sed interdum venenatis turpis enim blandit mi in porttitor pede justo eu,2023-11-14,,2023
173,,,,,,,,,ultrices posuere cubilia curae nulla dapibus dolor vel est donec odio justo sollicitudin ut suscipit a,2023-12-14,,2023
174,,,,,,,,,phasellus id sapien in sapien iaculis congue vivamus metus arcu adipiscing molestie,2023-05-03,,2023
175,,,,,,,,,vehicula condimentum curabitur in libero ut massa volutpat convallis morbi odio odio elementum eu interdum eu tincidunt,2023-06-03,,2023
176,,,,,,,,,felis sed interdum venenatis turpis enim blandit mi in porttitor pede justo eu massa,2023-06-29,,2023
177,,,,,,,,,tincidunt lacus at velit vivamus vel nulla eget eros elementum pellentesque quisque porta volutpat erat quisque,2023-01-06,,2023
178,,,,,,,,,turpis sed ante vivamus tortor duis mattis egestas metus aenean fermentum donec ut mauris eget massa tempor convallis nulla,2023-10-09,,2023
179,,,,,,,,,sed interdum venenatis turpis enim blandit mi in porttitor pede justo eu massa donec dapibus duis at,2023-11-24,,2023
180,,,,,,,,,libero nam dui proin leo odio porttitor id consequat in consequat ut nulla sed accumsan,2023-03-18,,2023
181,,,,,,,,,elit sodales scelerisque mauris sit amet eros suspendisse accumsan tortor quis turpis sed,2023-11-04,,2023
182,,,,,,,,,ut suscipit a feugiat et eros vestibulum ac est lacinia nisi venenatis tristique fusce congue diam id ornare imperdiet sapien,2023-04-18,,2023
183,,,,,,,,,tortor sollicitudin mi sit amet lobortis sapien sapien non mi integer ac neque duis,2023-04-15,,2023
184,,,,,,,,,turpis integer aliquet massa id lobortis convallis tortor risus dapibus augue vel accumsan,2023-01-21,,2023
185,,,,,,,,,semper rutrum nulla nunc purus phasellus in felis donec semper sapien a libero nam dui proin leo odio porttitor id,2023-01-18,,2023
186,,,,,,,,,metus vitae ipsum aliquam non mauris morbi non lectus aliquam sit amet,2023-06-08,,2023
187,,,,,,,,,ligula suspendisse ornare consequat lectus in est risus auctor sed tristique,2023-06-18,,2023
188,,,,,,,,,sapien dignissim vestibulum vestibulum ante ipsum primis in faucibus orci,2023-10-26,,2023
189,,,,,,,,,felis fusce posuere felis sed lacus morbi sem mauris laoreet ut rhoncus aliquet pulvinar sed nisl nunc rhoncus dui,2023-12-04,,2023
190,,,,,,,,,metus sapien ut nunc vestibulum ante ipsum primis in faucibus,2023-05-02,,2023
191,,,,,,,,,nascetur ridiculus mus etiam vel augue vestibulum rutrum rutrum neque aenean auctor gravida sem praesent id massa,2023-10-15,,2023
192,,,,,,,,,tempor convallis nulla neque libero convallis eget eleifend luctus ultricies,2023-08-22,2024-01-13,2023
193,,,,,,,,,non velit nec nisi vulputate nonummy maecenas tincidunt lacus at velit vivamus vel nulla,2023-09-17,,2023
194,,,,,,,,,nascetur ridiculus mus vivamus vestibulum sagittis sapien cum sociis natoque penatibus,2023-06-30,,2023
195,,,,,,,,,in ante vestibulum ante ipsum primis in faucibus orci luctus et ultrices posuere cubilia curae duis faucibus accumsan,2023-10-05,,2023
196,,,,,,,,,odio consequat varius integer ac leo pellentesque ultrices mattis odio,2023-01-21,,2023
197,,,,,,,,,aliquam sit amet diam in magna bibendum imperdiet nullam orci pede venenatis non sodales sed tincidunt eu felis,2023-02-22,,2023
198,,,,,,,,,rutrum nulla tellus in sagittis dui vel nisl duis ac nibh fusce lacus purus aliquet at feugiat non,2023-10-13,,2023
199,,,,,,,,,turpis eget elit sodales scelerisque mauris sit amet eros suspendisse accumsan tortor quis turpis sed,2023-09-18,,2023
200,,,,,,,,,vestibulum ante ipsum primis in faucibus orci luctus et ultrices posuere cubilia curae mauris viverra diam vitae quam,2023-04-15,,2023
201,,,,,,,,,ut blandit non interdum in ante vestibulum ante ipsum primis in faucibus,2023-12-28,,2023
202,,,,,,,,,donec quis orci eget orci vehicula condimentum curabitur in libero ut massa volutpat convallis morbi odio odio,2023-08-22,,2023
203,,,,,,,,,nascetur ridiculus mus etiam vel augue vestibulum rutrum rutrum neque,2023-01-16,,2023
204,,,,,,,,,ultrices aliquet maecenas leo odio condimentum id luctus nec molestie sed justo pellentesque viverra pede ac diam cras pellentesque,2023-11-14,,2023
205,,,,,,,,,pulvinar nulla pede ullamcorper augue a suscipit nulla elit ac nulla sed vel,2023-03-02,,2023
206,,,,,,,,,sagittis nam congue risus semper porta volutpat quam pede lobortis ligula sit amet eleifend pede libero quis orci nullam,2023-06-23,,2023
207,,,,,,,,,praesent blandit nam nulla integer pede justo lacinia eget tincidunt eget,2023-10-24,,2023
208,,,,,,,,,aliquam quis turpis eget elit sodales scelerisque mauris sit amet eros suspendisse accumsan tortor quis turpis,2023-12-29,,2023
